domain,use_case,use_case_description,knowledge_dimensions,task_id,task_title,reference_material,sample_questions,reference_material_source,comprehension_quiz_source,task_inspiration,task_description,cq_format,additional_prompts
Health,Medication adherence,Understanding prescription medication instructions,factual/procedural,thyroid-medication,Thyroid Medication Management,https://www.accessdata.fda.gov/drugsatfda_docs/label/2017/021342s023lbl.pdf,,FDA prescribing information,,,Learn proper administration of thyroid medication,single-select MCQs with 5 options and one correct answer,
Finance,Tax preparation,Understanding federal income tax forms,factual/procedural/conceptual,w4-withholding,W-4 Tax Withholding,https://www.irs.gov/pub/irs-pdf/fw4.pdf,,IRS Form W-4 (2024),,,Learn how to complete Form W-4,single-select MCQs with 5 options and one correct answer,
Health,Chronic disease management,Blood pressure monitoring and management,factual/conceptual/procedural,blood-pressure-basics,Blood Pressure Monitoring,,,,,Common patient education need,Learn blood pressure readings and categories,single-select MCQs with 5 options and one correct answer,
Civic,Voting rights,Voter registration procedures,factual/procedural,voter-registration,Voter Registration Process,,,,,Civic literacy gap,Learn voter registration requirements,single-select MCQs with 4 options and one correct answer,
Finance,Credit management,Understanding credit reports,factual/conceptual,credit-report-reading,Reading Credit Reports,https://www.consumerfinance.gov/consumer-tools/credit-reports-and-scores/,,CFPB,,,Learn to interpret credit reports,single-select MCQs with 5 options and one correct answer,
